{
  "corpus_fingerprint": "0729996461da44fbb8e88658ea388fa9e1c6f98f6142460bbc450fdfaa733de7",
  "generator": "scripts/generate_index.py",
  "record_count": 105,
  "records": [
    {
      "components": [
        "text",
        "control",
        "focus-indicator",
        "status"
      ],
      "fingerprint": "5ef82de894ea8f9e",
      "frameworks": [
        "agnostic"
      ],
      "id": "a11y.contrast-and-focus",
      "importance": "mandatory",
      "origin": "records/accessibility-quality.json",
      "sources": [
        "wcag-22",
        "uswds",
        "material-3"
      ],
      "status": "stable",
      "subtopic": "perception",
      "task_types": [
        "greenfield",
        "redesign",
        "component",
        "visual-audit"
      ],
      "title": "Verify contrast and focus in context",
      "topic": "accessibility"
    },
    {
      "components": [
        "interactive",
        "navigation",
        "form"
      ],
      "fingerprint": "fa92d9e103935cbb",
      "frameworks": [
        "agnostic",
        "react",
        "nextjs"
      ],
      "id": "a11y.keyboard-complete",
      "importance": "mandatory",
      "origin": "records/accessibility-quality.json",
      "sources": [
        "wcag-22",
        "wai-aria-apg",
        "react-aria"
      ],
      "status": "stable",
      "subtopic": "keyboard",
      "task_types": [
        "greenfield",
        "redesign",
        "component",
        "visual-audit"
      ],
      "title": "Make every task keyboard complete",
      "topic": "accessibility"
    },
    {
      "components": [
        "interactive",
        "form",
        "status",
        "navigation"
      ],
      "fingerprint": "75d1f91a1d0e3f1c",
      "frameworks": [
        "agnostic",
        "react",
        "nextjs"
      ],
      "id": "a11y.name-role-value",
      "importance": "mandatory",
      "origin": "records/accessibility-quality.json",
      "sources": [
        "wcag-22",
        "wai-aria-apg",
        "mdn-web-docs"
      ],
      "status": "stable",
      "subtopic": "semantics",
      "task_types": [
        "greenfield",
        "redesign",
        "component",
        "visual-audit"
      ],
      "title": "Expose accurate name, role, value, and state",
      "topic": "accessibility"
    },
    {
      "components": [
        "toast",
        "alert",
        "status",
        "upload",
        "search-results",
        "form"
      ],
      "fingerprint": "78d7cda5696aa9cb",
      "frameworks": [
        "react",
        "nextjs",
        "agnostic"
      ],
      "id": "a11y.status-without-disruption",
      "importance": "mandatory",
      "origin": "records/accessibility-quality.json",
      "sources": [
        "wai-aria-apg",
        "wcag-22",
        "react-aria"
      ],
      "status": "stable",
      "subtopic": "dynamic-updates",
      "task_types": [
        "component",
        "greenfield",
        "redesign"
      ],
      "title": "Announce status without disrupting work",
      "topic": "accessibility"
    },
    {
      "components": [
        "grid",
        "card",
        "feature-list",
        "dashboard"
      ],
      "fingerprint": "dd9372c01e5ede25",
      "frameworks": [
        "agnostic"
      ],
      "id": "anti.bento-by-default",
      "importance": "recommended",
      "origin": "records/anti-slop.json",
      "sources": [
        "taste-skill-repo",
        "material-3",
        "carbon-design-system"
      ],
      "status": "experimental",
      "subtopic": "bento-overuse",
      "task_types": [
        "greenfield",
        "redesign",
        "visual-audit"
      ],
      "title": "Do not force content into a bento grid",
      "topic": "anti-slop-integrity"
    },
    {
      "components": [
        "card",
        "section",
        "list",
        "dashboard"
      ],
      "fingerprint": "30628de843716418",
      "frameworks": [
        "agnostic"
      ],
      "id": "anti.card-everything",
      "importance": "mandatory",
      "origin": "records/anti-slop.json",
      "sources": [
        "taste-skill-repo",
        "govuk-design-system",
        "carbon-design-system"
      ],
      "status": "specialized",
      "subtopic": "card-overuse",
      "task_types": [
        "greenfield",
        "redesign",
        "visual-audit",
        "screenshot-reconstruction"
      ],
      "title": "Do not turn every group into a card",
      "topic": "anti-slop-integrity"
    },
    {
      "components": [
        "alert",
        "badge",
        "status",
        "icon",
        "callout",
        "list"
      ],
      "fingerprint": "8a3d859726041c61",
      "frameworks": [
        "agnostic"
      ],
      "id": "anti.decorative-signal-noise",
      "importance": "mandatory",
      "origin": "records/anti-slop.json",
      "sources": [
        "kill-ai-slop",
        "wcag-22",
        "govuk-design-system",
        "carbon-design-system"
      ],
      "status": "stable",
      "subtopic": "semantic-signal-noise",
      "task_types": [
        "greenfield",
        "redesign",
        "component",
        "visual-audit"
      ],
      "title": "Reserve signal styling for real status, priority, or action",
      "topic": "anti-slop-integrity"
    },
    {
      "components": [
        "card",
        "dialog",
        "popover",
        "navigation",
        "hero"
      ],
      "fingerprint": "e49edc4d191b4365",
      "frameworks": [
        "agnostic"
      ],
      "id": "anti.effects-stack",
      "importance": "recommended",
      "origin": "records/anti-slop.json",
      "sources": [
        "taste-skill-repo",
        "kill-ai-slop",
        "material-3",
        "apple-hig",
        "webdev"
      ],
      "status": "experimental",
      "subtopic": "surface-effects",
      "task_types": [
        "greenfield",
        "redesign",
        "visual-audit"
      ],
      "title": "Do not stack glass, glow, blur, border, and shadow by default",
      "topic": "anti-slop-integrity"
    },
    {
      "components": [
        "page",
        "navigation",
        "code-block",
        "hero",
        "dashboard"
      ],
      "fingerprint": "a16c8adbaa5da63d",
      "frameworks": [
        "agnostic"
      ],
      "id": "anti.generic-developer-shell",
      "importance": "recommended",
      "origin": "records/anti-slop.json",
      "sources": [
        "kill-ai-slop",
        "primer-design-system",
        "webdev"
      ],
      "status": "experimental",
      "subtopic": "developer-tool-template",
      "task_types": [
        "greenfield",
        "redesign",
        "visual-audit"
      ],
      "title": "Do not default developer products to a terminal costume",
      "topic": "anti-slop-integrity"
    },
    {
      "components": [
        "hero",
        "background",
        "button",
        "card"
      ],
      "fingerprint": "a9ad59dad0a1843c",
      "frameworks": [
        "agnostic"
      ],
      "id": "anti.gradient-everywhere",
      "importance": "recommended",
      "origin": "records/anti-slop.json",
      "sources": [
        "taste-skill-repo",
        "wcag-22",
        "material-3"
      ],
      "status": "experimental",
      "subtopic": "gradient-overuse",
      "task_types": [
        "greenfield",
        "redesign",
        "visual-audit"
      ],
      "title": "Do not use ambient gradients as default personality",
      "topic": "anti-slop-integrity"
    },
    {
      "components": [
        "hero",
        "heading",
        "call-to-action",
        "navigation"
      ],
      "fingerprint": "f019a0ba4c78769e",
      "frameworks": [
        "agnostic"
      ],
      "id": "anti.hero-empty-scale",
      "importance": "mandatory",
      "origin": "records/anti-slop.json",
      "sources": [
        "taste-skill-repo",
        "webdev",
        "govuk-design-system"
      ],
      "status": "specialized",
      "subtopic": "hero-overuse",
      "task_types": [
        "greenfield",
        "redesign",
        "visual-audit"
      ],
      "title": "Do not spend the first viewport on oversized generic hero copy",
      "topic": "anti-slop-integrity"
    },
    {
      "components": [
        "page",
        "theme",
        "component",
        "design-system"
      ],
      "fingerprint": "de78f31c73e79e0d",
      "frameworks": [
        "agnostic"
      ],
      "id": "anti.heuristic-triage",
      "importance": "mandatory",
      "origin": "records/anti-slop.json",
      "sources": [
        "kill-ai-slop",
        "taste-skill-repo",
        "material-3",
        "carbon-design-system"
      ],
      "status": "stable",
      "subtopic": "signal-triage",
      "task_types": [
        "greenfield",
        "redesign",
        "visual-audit"
      ],
      "title": "Treat anti-slop signals as hypotheses, not verdicts",
      "topic": "anti-slop-integrity"
    },
    {
      "components": [
        "page",
        "section",
        "card",
        "text",
        "navigation"
      ],
      "fingerprint": "96ad0166a17403ef",
      "frameworks": [
        "agnostic",
        "react"
      ],
      "id": "anti.motion-everywhere",
      "importance": "mandatory",
      "origin": "records/anti-slop.json",
      "sources": [
        "taste-skill-repo",
        "wcag-22",
        "transitions-dev-repo",
        "emil-design-skills"
      ],
      "status": "specialized",
      "subtopic": "motion-overuse",
      "task_types": [
        "motion",
        "greenfield",
        "redesign",
        "visual-audit"
      ],
      "title": "Do not animate every element into view",
      "topic": "anti-slop-integrity"
    },
    {
      "components": [
        "heading",
        "paragraph",
        "link",
        "call-to-action"
      ],
      "fingerprint": "03695d0a753861c4",
      "frameworks": [
        "agnostic"
      ],
      "id": "anti.ornamental-emphasis",
      "importance": "recommended",
      "origin": "records/anti-slop.json",
      "sources": [